{
  "title": "Custom Suit Order",
  "requires-steamodded": true,
  "requires-talisman": false,
  "categories": [
    "Quality of Life"
  ],
  "author": "DigitalDetective47",
  "repo": "https://github.com/DigitalDetective47/suit-order",
  "downloadURL": "https://github.com/DigitalDetective47/suit-order/archive/refs/heads/main.zip",
  "automatic-version-check": true,
  "version": "v1.0.2"
}
