{
  "title": "Fusion Jokers",
  "requires-steamodded": true,
  "requires-talisman": false,
  "categories": [
    "Joker",
    "API"
  ],
  "author": "itayfeder",
  "repo": "https://github.com/wingedcatgirl/Fusion-Jokers",
  "downloadURL": "https://github.com/wingedcatgirl/Fusion-Jokers/archive/refs/heads/main.zip",
  "automatic-version-check": true,
  "version": "3eaeae0"
}
