{
  "title": "QoL Bundle",
  "requires-steamodded": true,
  "requires-talisman": false,
  "categories": [
    "Quality of Life"
  ],
  "author": "Riosodu",
  "repo": "https://github.com/gfreitash/balatro-mods",
  "downloadURL": "https://github.com/gfreitash/balatro-mods/releases/download/qol-bundle__latest/qol-bundle.zip",
  "folderName": "qol-bundle",
  "automatic-version-check": true,
  "version": "rebalanced-stakes__v1.2.8"
}
