{
  "title": "Pokermon",
  "requires-steamodded": true,
  "requires-talisman": false,
  "categories": [
    "Content",
    "Joker"
  ],
  "author": "InertSteak",
  "folderName": "Pokermon",
  "repo": "https://github.com/InertSteak/Pokermon",
  "downloadURL": "https://github.com/InertSteak/Pokermon/archive/refs/heads/main.zip",
  "automatic-version-check": true,
  "version": "b77929a"
}
