{
  "title": "Balagay",
  "requires-steamodded": true,
  "requires-talisman": false,
  "categories": [
    "Miscellaneous"
  ],
  "author": "GitNether",
  "repo": "https://github.com/GitNether/balagay",
  "downloadURL": "https://github.com/GitNether/balagay/releases/download/v1.0.0/BalaGay.zip",
  "automatic-version-check": true,
  "version": "v1.0.0"
}
