
{
  "title": "Another Stupid Balatro Mod",
  "requires-steamodded": true,
  "requires-talisman": true,
  "categories": ["Joker"],
  "author": "Dogg Fly",
  "repo": "https://github.com/Dogg-Fly/Another-Stupid-Balatro-Mod",
  "downloadURL": "https://github.com/Dogg-Fly/Another-Stupid-Balatro-Mod/releases/latest/download/anotherstupidbalatromod.zip",
  "folderName": "anotherstupidbalatromod",
  "version": "2.6",
  "automatic-version-check": true
}

