{
  "title": "Too Many Decks",
  "requires-steamodded": true,
  "requires-talisman": true,
  "categories": [
    "Content"
  ],
  "author": "Squidguset",
  "repo": "https://github.com/Squidguset/TooManyDecks",
  "downloadURL": "https://github.com/Squidguset/TooManyDecks/archive/refs/heads/main.zip",
  "folderName": "TooManyDecks",
  "version": "542334d",
  "automatic-version-check": true
}
