{
  "title": "KCVanilla",
  "requires-steamodded": true,
  "requires-talisman": false,
  "categories": [
    "Joker"
  ],
  "author": "kcgidw",
  "repo": "https://github.com/kcgidw/kcvanilla",
  "downloadURL": "https://github.com/kcgidw/kcvanilla/archive/refs/heads/master.zip",
  "automatic-version-check": true,
  "version": "d12c1ec"
}
