{
  "title": "Mistigris",
  "requires-steamodded": true,
  "requires-talisman": false,
  "categories": [
    "Content",
    "Joker"
  ],
  "author": "astrapboy",
  "repo": "https://github.com/astrapboy/Mistigris",
  "downloadURL": "https://github.com/astrapboy/Mistigris/releases/latest/download/Mistigris.zip",
  "automatic-version-check": true,
  "version": "v0.3.1"
}
