{
  "title": "Steamodded",
  "requires-steamodded": false,
  "requires-talisman": false,
  "categories": [
    "Technical"
  ],
  "author": "Steamodded",
  "repo": "https://github.com/Steamodded/smods",
  "downloadURL": "https://github.com/Steamodded/smods/archive/refs/heads/main.zip",
  "automatic-version-check": true,
  "version": "c0fda63"
}
